{
  "series": "DWG-10-400",
  "title": "Jacking Drawings",
  "description": "Jacking drawings for BWB load distribution and jacking points",
  "ata_chapter": "10",
  "h2_related": false,
  "hv_related": false,
  "safety_critical": true,
  "drawings": [],
  "revision_history": [
    {
      "revision": "0",
      "date": "2025-12-09",
      "description": "Initial directory structure creation",
      "author": "AI Assistant (GitHub Copilot)"
    }
  ]
}
