{
  "series": "DWG-10-700",
  "title": "Protective Covers Drawings",
  "description": "Protective covers for H₂ vents, HV connectors, and aircraft protection",
  "ata_chapter": "10",
  "h2_related": true,
  "hv_related": true,
  "safety_critical": false,
  "drawings": [],
  "revision_history": [
    {
      "revision": "0",
      "date": "2025-12-09",
      "description": "Initial directory structure creation",
      "author": "AI Assistant (GitHub Copilot)"
    }
  ]
}