{
  "series": "DWG-10-900",
  "title": "HV System Drawings",
  "description": "HV system drawings for 800V+ electrical isolation and safety",
  "ata_chapter": "10",
  "h2_related": false,
  "hv_related": true,
  "safety_critical": true,
  "drawings": [],
  "revision_history": [
    {
      "revision": "0",
      "date": "2025-12-09",
      "description": "Initial directory structure creation",
      "author": "AI Assistant (GitHub Copilot)"
    }
  ]
}