{
  "series": "DWG-10-600",
  "title": "Ground Locks Drawings",
  "description": "Ground locks drawings for safety interlocks and locking devices",
  "ata_chapter": "10",
  "h2_related": false,
  "hv_related": false,
  "safety_critical": true,
  "drawings": [],
  "revision_history": [
    {
      "revision": "0",
      "date": "2025-12-09",
      "description": "Initial directory structure creation",
      "author": "AI Assistant (GitHub Copilot)"
    }
  ]
}