{
  "series": "DWG-10-800",
  "title": "H₂ System Drawings",
  "description": "H₂ system drawings for cryogenic storage, venting, and safety",
  "ata_chapter": "10",
  "h2_related": true,
  "hv_related": false,
  "safety_critical": true,
  "drawings": [],
  "revision_history": [
    {
      "revision": "0",
      "date": "2025-12-09",
      "description": "Initial directory structure creation",
      "author": "AI Assistant (GitHub Copilot)"
    }
  ]
}