{
  "series": "DWG-10-1400",
  "title": "Safety Signage Drawings",
  "description": "Safety signage drawings for warning labels and safety markings",
  "ata_chapter": "10",
  "h2_related": true,
  "hv_related": true,
  "safety_critical": true,
  "drawings": [],
  "revision_history": [
    {
      "revision": "0",
      "date": "2025-12-09",
      "description": "Initial directory structure creation",
      "author": "AI Assistant (GitHub Copilot)"
    }
  ]
}