{
  "series": "DWG-10-1100",
  "title": "Environmental Protection Drawings",
  "description": "Environmental protection drawings for storage preservation",
  "ata_chapter": "10",
  "h2_related": false,
  "hv_related": false,
  "safety_critical": false,
  "drawings": [],
  "revision_history": [
    {
      "revision": "0",
      "date": "2025-12-09",
      "description": "Initial directory structure creation",
      "author": "AI Assistant (GitHub Copilot)"
    }
  ]
}